{
  "$schema": "https://json-schema.org/draft/2020-12/schema",
  "$id": "https://idb.org.pe/knowledge/schema/tema.schema.json",
  "title": "IDB Knowledge Topic",
  "description": "Esquema unico para cualquier tema medico, preventivo o de bienestar de la Base de Conocimiento IDB.",
  "type": "object",
  "additionalProperties": false,
  "required": [
    "id",
    "slug",
    "titulo",
    "tipo",
    "categoria",
    "descripcion",
    "respuesta_rapida",
    "para_que_sirve",
    "causas",
    "sintomas",
    "factores_riesgo",
    "prevencion",
    "cuando_consultar",
    "senales_alarma",
    "precauciones",
    "preguntas_frecuentes",
    "temas_relacionados",
    "fuentes",
    "ultima_revision",
    "version"
  ],
  "properties": {
    "id": { "type": "string", "minLength": 1 },
    "slug": { "type": "string", "pattern": "^[a-z0-9]+(-[a-z0-9]+)*$" },
    "titulo": { "type": "string", "minLength": 1 },
    "tipo": {
      "type": "string",
      "enum": [
        "enfermedad",
        "sintoma",
        "medicamento",
        "examen",
        "procedimiento",
        "vacuna",
        "prevencion",
        "nutricion",
        "actividad-fisica",
        "salud-mental",
        "adulto-mayor",
        "salud-infantil",
        "salud-mujer",
        "salud-hombre",
        "bienestar"
      ]
    },
    "categoria": { "type": "string" },
    "descripcion": { "type": "string" },
    "respuesta_rapida": { "type": "string" },
    "para_que_sirve": { "type": "string" },
    "causas": { "type": "string" },
    "sintomas": { "type": "array", "items": { "type": "string" } },
    "factores_riesgo": { "type": "array", "items": { "type": "string" } },
    "prevencion": { "type": "array", "items": { "type": "string" } },
    "cuando_consultar": { "type": "string" },
    "senales_alarma": { "type": "string" },
    "precauciones": { "type": "array", "items": { "type": "string" } },
    "preguntas_frecuentes": {
      "type": "array",
      "maxItems": 5,
      "items": {
        "type": "object",
        "additionalProperties": false,
        "required": ["pregunta", "respuesta"],
        "properties": {
          "pregunta": { "type": "string" },
          "respuesta": { "type": "string" }
        }
      }
    },
    "temas_relacionados": {
      "type": "array",
      "items": {
        "type": "object",
        "additionalProperties": false,
        "required": ["id", "slug", "categoria"],
        "properties": {
          "id": { "type": "string" },
          "slug": { "type": "string" },
          "categoria": { "type": "string" },
          "titulo": { "type": "string" }
        }
      }
    },
    "fuentes": {
      "type": "array",
      "items": {
        "type": "object",
        "additionalProperties": false,
        "required": ["organizacion", "url"],
        "properties": {
          "id": { "type": "string" },
          "organizacion": { "type": "string" },
          "titulo": { "type": "string" },
          "url": { "type": "string" },
          "tipo": { "type": "string" }
        }
      }
    },
    "ultima_revision": { "type": "string", "pattern": "^\\d{4}-\\d{2}$" },
    "version": { "type": "string" }
  }
}
