{
  "id": "medicamento-atenolol",
  "slug": "atenolol",
  "titulo": "Atenolol",
  "tipo": "medicamento",
  "categoria": "Medicamentos",
  "descripcion": "Atenolol pertenece al grupo de medicamento cardiovascular. Para un paciente, lo mas importante es entender que no se elige solo por el nombre del sintoma, sino por el contexto clinico, antecedentes, alergias y otros medicamentos en uso. Se relaciona principalmente con control de presion, ritmo cardiaco, circulacion, liquidos o coagulacion. Antes de usarlo, es clave revisar enfermedades previas, embarazo o lactancia, edad, alergias y tratamientos actuales. Esta informacion busca ayudarte a conversar mejor con un profesional, no a decidir un tratamiento por cuenta propia.",
  "respuesta_rapida": "Atenolol suele considerarse para control de presion, ritmo cardiaco, circulacion, liquidos o coagulacion. En el organismo, modifica funciones cardiovasculares especificas y requiere seguimiento. No debe usarse para probar suerte ni mantenerse sin seguimiento si los sintomas persisten, cambian o se acompanan de señales de alarma.",
  "para_que_sirve": "Sirve como herramienta terapeutica cuando la situacion coincide con su perfil de uso y los riesgos han sido considerados. modifica funciones cardiovasculares especificas y requiere seguimiento. La misma molestia puede requerir decisiones distintas en dos personas, por eso la orientacion profesional sigue siendo central.",
  "causas": "No es una causa de enfermedad. Se evalua cuando hay un problema de salud que podria beneficiarse de control de presion, ritmo cardiaco, circulacion, liquidos o coagulacion. Si el motivo no esta claro, usarlo puede retrasar el diagnostico o cubrir señales importantes.",
  "sintomas": [],
  "factores_riesgo": [
    "antecedente de reaccion alergica o efecto adverso",
    "embarazo, lactancia, infancia o edad avanzada",
    "enfermedad renal, hepatica, cardiovascular, gastrica o neurologica segun el caso",
    "uso de varios medicamentos, suplementos o anticoagulantes"
  ],
  "prevencion": [
    "evitar automedicacion y uso compartido",
    "conservar el envase original y revisar fecha de vencimiento",
    "informar todos los medicamentos y suplementos en consulta",
    "consultar si el problema reaparece o necesita uso frecuente"
  ],
  "cuando_consultar": "Consulta antes de usar Atenolol si tienes dudas sobre su conveniencia, si tomas otros medicamentos, si hay embarazo o lactancia, si pertenece a un nino o adulto mayor, o si tienes antecedentes de alergia, enfermedad renal, hepatica, cardiaca, gastrica o de salud mental. Tambien consulta si aparece mareos, desmayos, sangrados, hinchazon, falta de aire o dolor de pecho.",
  "senales_alarma": "Busca atencion inmediata si despues de usarlo aparece dificultad para respirar, hinchazon de cara o labios, desmayo, ronchas extensas, sangrado importante, confusion, dolor de pecho, debilidad subita o empeoramiento rapido. Tambien presta atencion a mareos, desmayos, sangrados, hinchazon, falta de aire o dolor de pecho.",
  "precauciones": [
    "Vigila especialmente mareos, desmayos, sangrados, hinchazon, falta de aire o dolor de pecho.",
    "No lo combines con otros medicamentos sin orientacion profesional.",
    "No lo uses para reemplazar una evaluacion si el sintoma es intenso, nuevo o persistente.",
    "No suspendas tratamientos indicados sin consultar."
  ],
  "preguntas_frecuentes": [
    {
      "pregunta": "¿Atenolol sirve para cualquier molestia?",
      "respuesta": "No. Se relaciona con control de presion, ritmo cardiaco, circulacion, liquidos o coagulacion, pero la indicacion depende del contexto y de la evaluacion de riesgos."
    },
    {
      "pregunta": "¿Que debo contar antes de usarlo?",
      "respuesta": "Alergias, embarazo o lactancia, enfermedades previas, medicamentos actuales, suplementos y reacciones anteriores."
    },
    {
      "pregunta": "¿Puedo mezclarlo con otros medicamentos?",
      "respuesta": "No conviene hacerlo sin orientacion, porque algunas combinaciones aumentan efectos no deseados o reducen la seguridad."
    },
    {
      "pregunta": "¿Cuando debo buscar ayuda pronto?",
      "respuesta": "Si aparece mareos, desmayos, sangrados, hinchazon, falta de aire o dolor de pecho, o cualquier señal de alarma como falta de aire, desmayo, hinchazon o sangrado."
    }
  ],
  "temas_relacionados": [
    {
      "id": "rel-hipertension",
      "slug": "hipertension",
      "categoria": "Orientacion",
      "titulo": "Hipertension"
    },
    {
      "id": "rel-dolor-de-pecho",
      "slug": "dolor-de-pecho",
      "categoria": "Orientacion",
      "titulo": "Dolor de pecho"
    },
    {
      "id": "rel-palpitaciones",
      "slug": "palpitaciones",
      "categoria": "Orientacion",
      "titulo": "Palpitaciones"
    },
    {
      "id": "rel-hinchazon-de-piernas",
      "slug": "hinchazon-de-piernas",
      "categoria": "Orientacion",
      "titulo": "Hinchazon de piernas"
    }
  ],
  "fuentes": [
    {
      "id": "fda",
      "organizacion": "FDA",
      "titulo": "Informacion regulatoria sobre medicamentos",
      "url": "https://www.fda.gov/drugs",
      "tipo": "Referencia regulatoria"
    },
    {
      "id": "medlineplus",
      "organizacion": "MedlinePlus",
      "titulo": "Medicamentos y suplementos",
      "url": "https://medlineplus.gov/spanish/druginformation.html",
      "tipo": "Referencia educativa"
    },
    {
      "id": "nih",
      "organizacion": "NIH",
      "titulo": "Informacion de salud para pacientes",
      "url": "https://www.nih.gov/health-information",
      "tipo": "Referencia cientifica"
    }
  ],
  "ultima_revision": "2026-06",
  "version": "1.0"
}
