{
  "id": "medicamento-prednisona",
  "slug": "prednisona",
  "titulo": "Prednisona",
  "tipo": "medicamento",
  "categoria": "Medicamentos",
  "descripcion": "Prednisona es un medicamento de uso especifico utilizado en situaciones donde un profesional identifica que puede aportar beneficio. Su seguridad depende tanto del motivo de uso como de la persona que lo recibe. Se relaciona principalmente con una indicacion concreta definida por un profesional. Antes de usarlo, es clave revisar enfermedades previas, embarazo o lactancia, edad, alergias y tratamientos actuales. Esta informacion busca ayudarte a conversar mejor con un profesional, no a decidir un tratamiento por cuenta propia.",
  "respuesta_rapida": "Prednisona suele considerarse para una indicacion concreta definida por un profesional. En el organismo, actua sobre procesos particulares del organismo segun su clase. No debe usarse para probar suerte ni mantenerse sin seguimiento si los sintomas persisten, cambian o se acompanan de señales de alarma.",
  "para_que_sirve": "Sirve como herramienta terapeutica cuando la situacion coincide con su perfil de uso y los riesgos han sido considerados. actua sobre procesos particulares del organismo segun su clase. La misma molestia puede requerir decisiones distintas en dos personas, por eso la orientacion profesional sigue siendo central.",
  "causas": "No es una causa de enfermedad. Se evalua cuando hay un problema de salud que podria beneficiarse de una indicacion concreta definida por un profesional. Si el motivo no esta claro, usarlo puede retrasar el diagnostico o cubrir señales importantes.",
  "sintomas": [],
  "factores_riesgo": [
    "antecedente de reaccion alergica o efecto adverso",
    "embarazo, lactancia, infancia o edad avanzada",
    "enfermedad renal, hepatica, cardiovascular, gastrica o neurologica segun el caso",
    "uso de varios medicamentos, suplementos o anticoagulantes"
  ],
  "prevencion": [
    "evitar automedicacion y uso compartido",
    "conservar el envase original y revisar fecha de vencimiento",
    "informar todos los medicamentos y suplementos en consulta",
    "consultar si el problema reaparece o necesita uso frecuente"
  ],
  "cuando_consultar": "Consulta antes de usar Prednisona si tienes dudas sobre su conveniencia, si tomas otros medicamentos, si hay embarazo o lactancia, si pertenece a un nino o adulto mayor, o si tienes antecedentes de alergia, enfermedad renal, hepatica, cardiaca, gastrica o de salud mental. Tambien consulta si aparece alergias, interacciones, embarazo, enfermedades previas o reacciones inesperadas.",
  "senales_alarma": "Busca atencion inmediata si despues de usarlo aparece dificultad para respirar, hinchazon de cara o labios, desmayo, ronchas extensas, sangrado importante, confusion, dolor de pecho, debilidad subita o empeoramiento rapido. Tambien presta atencion a alergias, interacciones, embarazo, enfermedades previas o reacciones inesperadas.",
  "precauciones": [
    "Vigila especialmente alergias, interacciones, embarazo, enfermedades previas o reacciones inesperadas.",
    "No lo combines con otros medicamentos sin orientacion profesional.",
    "No lo uses para reemplazar una evaluacion si el sintoma es intenso, nuevo o persistente.",
    "No suspendas tratamientos indicados sin consultar."
  ],
  "preguntas_frecuentes": [
    {
      "pregunta": "¿Prednisona sirve para cualquier molestia?",
      "respuesta": "No. Se relaciona con una indicacion concreta definida por un profesional, pero la indicacion depende del contexto y de la evaluacion de riesgos."
    },
    {
      "pregunta": "¿Que debo contar antes de usarlo?",
      "respuesta": "Alergias, embarazo o lactancia, enfermedades previas, medicamentos actuales, suplementos y reacciones anteriores."
    },
    {
      "pregunta": "¿Puedo mezclarlo con otros medicamentos?",
      "respuesta": "No conviene hacerlo sin orientacion, porque algunas combinaciones aumentan efectos no deseados o reducen la seguridad."
    },
    {
      "pregunta": "¿Cuando debo buscar ayuda pronto?",
      "respuesta": "Si aparece alergias, interacciones, embarazo, enfermedades previas o reacciones inesperadas, o cualquier señal de alarma como falta de aire, desmayo, hinchazon o sangrado."
    }
  ],
  "temas_relacionados": [
    {
      "id": "rel-uso-seguro-de-medicamentos",
      "slug": "uso-seguro-de-medicamentos",
      "categoria": "Orientacion",
      "titulo": "Uso seguro de medicamentos"
    },
    {
      "id": "rel-organizacion-de-medicamentos",
      "slug": "organizacion-de-medicamentos",
      "categoria": "Orientacion",
      "titulo": "Organizacion de medicamentos"
    },
    {
      "id": "rel-preparar-una-consulta-medica",
      "slug": "preparar-una-consulta-medica",
      "categoria": "Orientacion",
      "titulo": "Preparar una consulta medica"
    },
    {
      "id": "rel-preguntas-frecuentes-de-salud",
      "slug": "preguntas-frecuentes-de-salud",
      "categoria": "Orientacion",
      "titulo": "Preguntas frecuentes de salud"
    }
  ],
  "fuentes": [
    {
      "id": "fda",
      "organizacion": "FDA",
      "titulo": "Informacion regulatoria sobre medicamentos",
      "url": "https://www.fda.gov/drugs",
      "tipo": "Referencia regulatoria"
    },
    {
      "id": "medlineplus",
      "organizacion": "MedlinePlus",
      "titulo": "Medicamentos y suplementos",
      "url": "https://medlineplus.gov/spanish/druginformation.html",
      "tipo": "Referencia educativa"
    },
    {
      "id": "nih",
      "organizacion": "NIH",
      "titulo": "Informacion de salud para pacientes",
      "url": "https://www.nih.gov/health-information",
      "tipo": "Referencia cientifica"
    }
  ],
  "ultima_revision": "2026-06",
  "version": "1.0"
}
