{
  "id": "sintoma-dolor-al-hacer-ejercicio",
  "slug": "dolor-al-hacer-ejercicio",
  "titulo": "Dolor al hacer ejercicio",
  "tipo": "sintoma",
  "categoria": "Cardiorrespiratorio",
  "descripcion": "Dolor al hacer ejercicio puede aparecer de forma aislada o junto con otros cambios del organismo. Para interpretarlo conviene observar cuando comenzo, si fue repentino o gradual, que tan intenso es, que lo mejora o empeora y si aparece con otros sintomas. En muchas ocasiones la causa es pasajera, pero algunos patrones requieren evaluacion.",
  "respuesta_rapida": "Dolor al hacer ejercicio puede relacionarse con resfrio, alergias, irritantes ambientales, asma, bronquitis u otras infecciones respiratorias. Puedes observar la evolucion si no hay falta de aire, fiebre alta ni decaimiento importante; conviene consultar si hay dificultad para respirar, dolor de pecho, labios morados, fiebre alta o empeoramiento rapido. La clave es no mirar el sintoma aislado, sino su contexto.",
  "para_que_sirve": "Reconocer y describir dolor al hacer ejercicio ayuda a decidir el siguiente paso: observacion, orientacion digital, consulta programada o atencion inmediata. Anotar duracion, intensidad y sintomas asociados facilita una evaluacion mas segura.",
  "causas": "Las causas frecuentes incluyen resfrio, alergias, irritantes ambientales, asma, bronquitis u otras infecciones respiratorias. Tambien influyen edad, embarazo, enfermedades previas, medicamentos, hidratacion, alimentacion, actividad fisica, descanso y exposicion a infecciones o irritantes.",
  "sintomas": [
    "Dolor al hacer ejercicio",
    "dolor con esfuerzo",
    "me duele al ejercitar",
    "dolor al correr"
  ],
  "factores_riesgo": [
    "inicio brusco o intensidad inusual",
    "duracion prolongada o episodios repetidos",
    "enfermedades previas, embarazo, infancia o edad avanzada",
    "aparicion junto con fiebre alta, dolor fuerte, desmayo, falta de aire o sangrado"
  ],
  "prevencion": [
    "mantener hidratacion y descanso adecuados cuando corresponda",
    "evitar automedicacion si el sintoma es nuevo, intenso o persistente",
    "registrar evolucion y sintomas asociados",
    "buscar orientacion temprana si limita actividades o se repite"
  ],
  "cuando_consultar": "Consulta por dolor al hacer ejercicio si se acompana de dificultad para respirar, dolor de pecho, labios morados, fiebre alta o empeoramiento rapido. Puedes observar la evolucion solo si no hay falta de aire, fiebre alta ni decaimiento importante, pero busca orientacion si existen asma, EPOC, defensas bajas o edad extrema. Si el sintoma cambia de patron, aumenta o te preocupa, es mejor pedir una evaluacion.",
  "senales_alarma": "Busca atencion inmediata si presentas dificultad para respirar, dolor de pecho, perdida de conciencia, sangrado importante, debilidad subita, confusion, labios morados, convulsiones o empeoramiento rapido.",
  "precauciones": [
    "No ignores sintomas que progresan rapido o cambian de forma marcada.",
    "Evita automedicarte si no conoces la causa.",
    "No retrases atencion cuando existan señales de alarma.",
    "Ten a mano informacion sobre medicamentos, alergias y antecedentes."
  ],
  "preguntas_frecuentes": [
    {
      "pregunta": "¿Que puede significar Dolor al hacer ejercicio?",
      "respuesta": "Puede relacionarse con resfrio, alergias, irritantes ambientales, asma, bronquitis u otras infecciones respiratorias. La causa exacta depende de la evolucion y de los sintomas que lo acompanan."
    },
    {
      "pregunta": "¿Cuando puedo observar en casa?",
      "respuesta": "Cuando es leve, no hay señales de alarma y cumple esta condicion: si no hay falta de aire, fiebre alta ni decaimiento importante."
    },
    {
      "pregunta": "¿Que informacion debo registrar?",
      "respuesta": "Inicio, duracion, intensidad, desencadenantes, sintomas asociados, temperatura, medicamentos usados y si ya ocurrio antes."
    },
    {
      "pregunta": "¿Cuando no debo esperar?",
      "respuesta": "No esperes si si hay dificultad para respirar, dolor de pecho, labios morados, fiebre alta o empeoramiento rapido, o si aparecen signos como falta de aire, desmayo, sangrado, confusion o dolor de pecho."
    }
  ],
  "temas_relacionados": [
    {
      "id": "rel-musculo",
      "slug": "musculo",
      "categoria": "Relacionados",
      "titulo": "musculo"
    },
    {
      "id": "rel-corazon",
      "slug": "corazon",
      "categoria": "Relacionados",
      "titulo": "corazon"
    },
    {
      "id": "rel-lesion",
      "slug": "lesion",
      "categoria": "Relacionados",
      "titulo": "lesion"
    }
  ],
  "fuentes": [
    {
      "id": "medlineplus",
      "organizacion": "MedlinePlus",
      "titulo": "Informacion para pacientes",
      "url": "https://medlineplus.gov/spanish/",
      "tipo": "Referencia educativa"
    },
    {
      "id": "ops",
      "organizacion": "OPS",
      "titulo": "Informacion sanitaria regional",
      "url": "https://www.paho.org/es",
      "tipo": "Organismo sanitario"
    },
    {
      "id": "minsa",
      "organizacion": "MINSA",
      "titulo": "Orientacion sanitaria para la poblacion",
      "url": "https://www.gob.pe/minsa",
      "tipo": "Referencia nacional"
    }
  ],
  "ultima_revision": "2026-06",
  "version": "1.0"
}
