{
  "id": "enfermedad-estrenimiento-cronico",
  "slug": "estrenimiento-cronico",
  "titulo": "Estreñimiento cronico",
  "tipo": "enfermedad",
  "categoria": "Digestivo",
  "descripcion": "Estreñimiento cronico es una condicion vinculada con aparato digestivo. Puede variar desde situaciones controlables hasta cuadros que requieren seguimiento cercano. Para entenderla se consideran sintomas, tiempo de evolucion, factores de riesgo, examenes y respuesta a cuidados previos.",
  "respuesta_rapida": "Estreñimiento cronico se relaciona con infecciones, inflamacion, reflujo, alimentacion, medicamentos, alcohol, intolerancias o cambios en estomago, intestino, higado o vesicula. Lo importante para el paciente es reconocer manifestaciones frecuentes, prevenir complicaciones y consultar a tiempo. Esta ficha orienta, pero no confirma ni descarta diagnosticos.",
  "para_que_sirve": "Conocer Estreñimiento cronico ayuda a preparar una consulta, reconocer factores de riesgo, entender por que pueden solicitarse examenes y saber que senales ameritan atencion. Tambien permite ordenar preguntas sobre prevencion, seguimiento y cambios de estilo de vida.",
  "causas": "Puede originarse o empeorar por infecciones, inflamacion, reflujo, alimentacion, medicamentos, alcohol, intolerancias o cambios en estomago, intestino, higado o vesicula. En muchos casos intervienen varios factores al mismo tiempo, por eso la evaluacion profesional integra antecedentes, examen clinico y, si corresponde, pruebas complementarias.",
  "sintomas": [
    "dolor de estomago",
    "nauseas",
    "vomitos",
    "diarrea",
    "acidez"
  ],
  "factores_riesgo": [
    "uso frecuente de antiinflamatorios",
    "alcohol o tabaco",
    "antecedentes digestivos",
    "sangrado o perdida de peso"
  ],
  "prevencion": [
    "evitar irritantes conocidos",
    "mantener hidratacion",
    "consultar por sintomas persistentes",
    "no automedicarse ante dolor intenso"
  ],
  "cuando_consultar": "Consulta si sospechas estreñimiento cronico, si los sintomas son persistentes, si existen factores de riesgo o si ya tienes diagnostico y notas cambios. El seguimiento ayuda a prevenir complicaciones, ajustar cuidados e interpretar examenes.",
  "senales_alarma": "Busca atencion inmediata si presentas dificultad para respirar, dolor de pecho, perdida de conciencia, sangrado importante, debilidad subita, confusion, fiebre alta persistente o empeoramiento rapido.",
  "precauciones": [
    "No uses esta informacion para confirmar o descartar la enfermedad por tu cuenta.",
    "No suspendas controles ni tratamientos indicados sin consultar.",
    "Evita automedicacion o remedios que retrasen una evaluacion necesaria.",
    "Busca orientacion si los sintomas cambian, progresan o aparecen señales de alarma."
  ],
  "preguntas_frecuentes": [
    {
      "pregunta": "¿Que es Estreñimiento cronico?",
      "respuesta": "Es una condicion relacionada con aparato digestivo. Su evaluacion depende de sintomas, antecedentes, exploracion clinica y, a veces, examenes."
    },
    {
      "pregunta": "¿Que sintomas pueden aparecer?",
      "respuesta": "Pueden observarse dolor de estomago, nauseas, vomitos, diarrea, aunque no todas las personas presentan los mismos signos."
    },
    {
      "pregunta": "¿Se puede prevenir o controlar?",
      "respuesta": "En muchos casos ayudan medidas como evitar irritantes conocidos, mantener hidratacion, consultar por sintomas persistentes, junto con seguimiento profesional cuando corresponde."
    },
    {
      "pregunta": "¿Cuando debo consultar?",
      "respuesta": "Consulta si hay sintomas persistentes, factores de riesgo, dudas sobre examenes, cambios en la evolucion o cualquier señal de alarma."
    }
  ],
  "temas_relacionados": [
    {
      "id": "rel-dolor-de-estomago",
      "slug": "dolor-de-estomago",
      "categoria": "Relacionados",
      "titulo": "dolor de estomago"
    },
    {
      "id": "rel-nauseas",
      "slug": "nauseas",
      "categoria": "Relacionados",
      "titulo": "nauseas"
    },
    {
      "id": "rel-vomitos",
      "slug": "vomitos",
      "categoria": "Relacionados",
      "titulo": "vomitos"
    },
    {
      "id": "rel-diarrea",
      "slug": "diarrea",
      "categoria": "Relacionados",
      "titulo": "diarrea"
    }
  ],
  "fuentes": [
    {
      "id": "oms",
      "organizacion": "OMS",
      "titulo": "Temas de salud",
      "url": "https://www.who.int/health-topics",
      "tipo": "Organismo sanitario"
    },
    {
      "id": "ops",
      "organizacion": "OPS",
      "titulo": "Informacion sanitaria regional",
      "url": "https://www.paho.org/es",
      "tipo": "Organismo sanitario"
    },
    {
      "id": "medlineplus",
      "organizacion": "MedlinePlus",
      "titulo": "Informacion para pacientes",
      "url": "https://medlineplus.gov/spanish/",
      "tipo": "Referencia educativa"
    },
    {
      "id": "cdc",
      "organizacion": "CDC",
      "titulo": "Informacion de salud publica",
      "url": "https://www.cdc.gov/spanish/",
      "tipo": "Salud publica"
    }
  ],
  "ultima_revision": "2026-06",
  "version": "1.0"
}
